Handle,Title,Body (HTML),Vendor,Type,Tags,Published,Option1 Name,Option1 Value,Variant SKU,Variant Grams,Variant Inventory Tracker,Variant Inventory Qty,Variant Price,Variant Compare At Price,Variant Requires Shipping,Variant Taxable,Variant Barcode,Image Src,Image Position,Image Alt Text,Gift Card,SEO Title,SEO Description,Google Shopping / Google Product Category,Google Shopping / Gender,Google Shopping / Age Group,Google Shopping / MPN,Google Shopping / Custom Product,Google Shopping / Custom Label 0,Variant Image,Variant Weight Unit,Variant Tax Code,Cost per item,Status
ice-roller-face-globes,Ice Roller Face Globes,<p>Ice Roller Face Globes — Beauty</p>,DropAtom,Beauty,"ice roller, face globes, skincare, puffiness, de-puff, morning routine",TRUE,Size,Standard,DA-ice-roll,200,shopify,100,24.9,44.82,TRUE,TRUE,,,1,Ice Roller Face Globes,FALSE,Ice Roller Face Globes,,Beauty,unisex,adult,DA-ice-roll,FALSE,dropatom,,kg,,2.6,active
foot-peel-mask-exfoliant,Foot Peel Mask Exfoliant,<p>Foot Peel Mask Exfoliant — Beauty</p>,DropAtom,Beauty,"foot peel, exfoliant, skincare, baby foot, beauty",TRUE,Size,Standard,DA-foot-pee,200,shopify,100,17.9,32.22,TRUE,TRUE,,,1,Foot Peel Mask Exfoliant,FALSE,Foot Peel Mask Exfoliant,,Beauty,unisex,adult,DA-foot-pee,FALSE,dropatom,,kg,,2.17,active
bamboo-sunglasses-polarized,Bamboo Sunglasses Polarized,<p>Bamboo Sunglasses Polarized — Fashion</p>,DropAtom,Fashion,"sunglasses, bamboo, polarized, eco, wood, uv, summer",TRUE,Size,Standard,DA-bamboo-s,200,shopify,100,29.9,53.82,TRUE,TRUE,,,1,Bamboo Sunglasses Polarized,FALSE,Bamboo Sunglasses Polarized,,Fashion,unisex,adult,DA-bamboo-s,FALSE,dropatom,,kg,,3.27,active
posture-corrector-pro,Posture Corrector Pro,<p>Posture Corrector Pro — Health</p>,DropAtom,Health,"posture, back pain, office, ergonomic, health",TRUE,Size,Standard,DA-posture-,200,shopify,100,34.9,62.82,TRUE,TRUE,,,1,Posture Corrector Pro,FALSE,Posture Corrector Pro,,Health,unisex,adult,DA-posture-,FALSE,dropatom,,kg,,4.78,active
neck-massager-electric,Neck Massager Electric,<p>Neck Massager Electric — Health</p>,DropAtom,Health,"neck massager, pain relief, massage, stress, wellness",TRUE,Size,Standard,DA-neck-mas,200,shopify,100,49.9,89.82,TRUE,TRUE,,,1,Neck Massager Electric,FALSE,Neck Massager Electric,,Health,unisex,adult,DA-neck-mas,FALSE,dropatom,,kg,,16.31,active
